{
  "task_id": "019921c6-5a8c-7cc4-bf08-2d33622c7611",
  "kind": "task",
  "task_type": "incident.notification.requested",
  "schema_version": "1.0",
  "created_at": "2026-09-17T13:00:00Z",
  "producer": "opsflow-task-publisher",
  "correlation_id": "019921c6-6114-7a84-bde7-44034281e503",
  "causation_id": null,
  "idempotency_key": "incident:123:notification:opened",
  "payload": {
    "incident_id": 123,
    "notification_type": "incident-opened"
  },
  "metadata": {
    "environment": "development"
  }
}
